{
 "version": "2.0",
 "change_mode": "incremental",
 "generated_at": "2026-09-10T16:34:08+00:00",
 "sources": [
  {
   "id": "cnpq",
   "name": "CNPq",
   "url": "https://www.gov.br/cnpq/pt-br/chamadas/abertas-para-submissao",
   "status": "healthy",
   "checked_at": "2026-09-10T16:33:19+00:00",
   "last_success_at": "2026-09-10T16:33:19+00:00",
   "last_change_at": "2026-09-03T16:34:20+00:00",
   "opportunity_count": 7,
   "consecutive_errors": 0,
   "error": null
  },
  {
   "id": "fapesq",
   "name": "FAPESQ-PB",
   "url": "https://fapesq.rpp.br/editais/2026/editais-2026",
   "status": "healthy",
   "checked_at": "2026-09-10T16:33:18+00:00",
   "last_success_at": "2026-09-10T16:33:18+00:00",
   "last_change_at": "2026-08-20T12:32:07+00:00",
   "opportunity_count": 3,
   "consecutive_errors": 0,
   "error": null
  },
  {
   "id": "finep",
   "name": "Finep",
   "url": "https://www.finep.gov.br/oportunidades",
   "status": "healthy",
   "checked_at": "2026-09-10T16:33:23+00:00",
   "last_success_at": "2026-09-10T16:33:23+00:00",
   "last_change_at": "2026-09-10T16:33:23+00:00",
   "opportunity_count": 11,
   "consecutive_errors": 0,
   "error": null
  },
  {
   "id": "transferegov",
   "name": "TransfereGov",
   "url": "https://repositorio.dados.gov.br/seges/detru/",
   "status": "healthy",
   "checked_at": "2026-09-10T16:33:32+00:00",
   "last_success_at": "2026-09-10T16:33:32+00:00",
   "last_change_at": "2026-09-10T16:33:32+00:00",
   "opportunity_count": 147,
   "consecutive_errors": 0,
   "error": null
  }
 ],
 "summary": {
  "monitored": 171,
  "open": 165,
  "urgent": 41,
  "new": 18,
  "changed": 0,
  "closed": 3,
  "unchanged": 150,
  "priority_a": 6,
  "stale_sources": 0
 },
 "opportunities": [
  {
   "id": "transferegov-903a9f369f75-proposta",
   "source": {
    "id": "transferegov",
    "name": "TransfereGov",
    "official": true,
    "url": "https://repositorio.dados.gov.br/seges/detru/",
    "checked_at": "2026-09-10T16:33:32+00:00",
    "stale": false
   },
   "external_id": "903a9f369f75-proposta",
   "title": "SENAD - Programa Território Seguro, Amazônia Soberana: Proteção da Amazônia e da Faixa de Fronteira – Eixo 6 – FIIS",
   "description": null,
   "funder": "MINISTERIO DA JUSTICA E SEGURANCA PUBLICA",
   "instrument": {
    "type": "convenio",
    "repayable": false
   },
   "status": "open",
   "dates": {
    "published": "2026-07-20",
    "deadline": "2026-09-10"
   },
   "eligibility": {
    "organization_types": [
     "estado"
    ],
    "geography": [
     "PB"
    ]
   },
   "themes": [],
   "funding": {
    "program_budget": null
   },
   "documents": [],
   "changes": [],
   "change_status": "new",
   "matching": {
    "eligible": true,
    "ponte_score": 60,
    "portfolio_tags": [
     "clima",
     "energia",
     "cidades",
     "esg",
     "impacto_social",
     "territorio",
     "politicas_publicas"
    ],
    "matches": [
     {
      "portfolio_id": "ponte-clima",
      "portfolio_name": "PONTE — Clima, Energia e Cidades",
      "score": 60,
      "reasons": [
       "proponente: estado",
       "território compatível"
      ]
     },
     {
      "portfolio_id": "ponte-impacto-publico",
      "portfolio_name": "PONTE — Desenvolvimento Territorial e Impacto",
      "score": 60,
      "reasons": [
       "proponente: estado",
       "território compatível"
      ]
     }
    ]
   }
  },
  {
   "id": "transferegov-7bb9c38d13a7-emenda",
   "source": {
    "id": "transferegov",
    "name": "TransfereGov",
    "official": true,
    "url": "https://repositorio.dados.gov.br/seges/detru/",
    "checked_at": "2026-09-10T16:33:32+00:00",
    "stale": false
   },
   "external_id": "7bb9c38d13a7-emenda",
   "title": "Emenda de Comissao - Publico",
   "description": null,
   "funder": "MINISTERIO DA CULTURA",
   "instrument": {
    "type": "convenio",
    "repayable": false
   },
   "status": "open",
   "dates": {
    "published": "2026-05-04",
    "deadline": "2026-09-11"
   },
   "eligibility": {
    "organization_types": [
     "municipio"
    ],
    "geography": [
     "PB"
    ]
   },
   "themes": [],
   "funding": {
    "program_budget": null
   },
   "documents": [],
   "changes": [],
   "change_status": "unchanged",
   "matching": {
    "eligible": true,
    "ponte_score": 60,
    "portfolio_tags": [
     "clima",
     "energia",
     "cidades",
     "esg",
     "impacto_social",
     "territorio",
     "politicas_publicas"
    ],
    "matches": [
     {
      "portfolio_id": "ponte-clima",
      "portfolio_name": "PONTE — Clima, Energia e Cidades",
      "score": 60,
      "reasons": [
       "proponente: municipio",
       "território compatível"
      ]
     },
     {
      "portfolio_id": "ponte-impacto-publico",
      "portfolio_name": "PONTE — Desenvolvimento Territorial e Impacto",
      "score": 60,
      "reasons": [
       "proponente: municipio",
       "território compatível"
      ]
     }
    ]
   }
  },
  {
   "id": "transferegov-9772f02b3bb4-emenda",
   "source": {
    "id": "transferegov",
    "name": "TransfereGov",
    "official": true,
    "url": "https://repositorio.dados.gov.br/seges/detru/",
    "checked_at": "2026-09-10T16:33:32+00:00",
    "stale": false
   },
   "external_id": "9772f02b3bb4-emenda",
   "title": "Apoio Familiar e Comunitário - fortalecendo redes socioassistenciais!",
   "description": null,
   "funder": "MINISTERIO DA EDUCACAO",
   "instrument": {
    "type": "convenio",
    "repayable": false
   },
   "status": "open",
   "dates": {
    "published": "2026-05-11",
    "deadline": "2026-09-11"
   },
   "eligibility": {
    "organization_types": [
     "osc"
    ],
    "geography": [
     "PB"
    ]
   },
   "themes": [
    "socioassist"
   ],
   "funding": {
    "program_budget": null
   },
   "documents": [],
   "changes": [],
   "change_status": "new",
   "matching": {
    "eligible": true,
    "ponte_score": 60,
    "portfolio_tags": [
     "clima",
     "energia",
     "cidades",
     "esg",
     "impacto_social",
     "territorio",
     "politicas_publicas"
    ],
    "matches": [
     {
      "portfolio_id": "ponte-clima",
      "portfolio_name": "PONTE — Clima, Energia e Cidades",
      "score": 60,
      "reasons": [
       "proponente: osc",
       "território compatível"
      ]
     },
     {
      "portfolio_id": "ponte-impacto-publico",
      "portfolio_name": "PONTE — Desenvolvimento Territorial e Impacto",
      "score": 60,
      "reasons": [
       "proponente: osc",
       "território compatível"
      ]
     }
    ]
   }
  },
  {
   "id": "finep-749717",
   "source": {
    "id": "finep",
    "name": "Finep",
    "official": true,
    "url": "https://www.finep.gov.br/e/chamada-publica/222684/749717",
    "checked_at": "2026-09-10T16:33:23+00:00",
    "stale": false
   },
   "external_id": "749717",
   "title": "Conhecimento Brasil",
   "description": "O Ministério da Ciência, Tecnologia e Inovação (MCTI) e a Financiadora de Estudos e Projetos (Finep) tornam pública a presente Seleção, cujo objetivo é conceder recursos de subvenção econômica para viabilizar: (i) a repatriação de pesquisadores e profissionais técnicos especializados, brasileiros, que estejam trabalhando em outro país no momento de submissão da proposta e que tenham disponibilidade para voltar a trabalhar no Brasil e se dedicar às atividades previstas no plano de trabalho; e/ou (ii) a fixação de pesquisadores doutores, brasileiros, que não estejam trabalhando em atividades de P,D&I em empresa brasileira no momento de submissão da proposta, e que tenham disponibilidade de se dedicar às atividades previstas no plano de trabalho, para serem contratados por empresas brasileiras. Os projetos submetidos deverão indicar especificamente os pesquisadores e/ou profissionais técnicos especializados a serem contratados demonstrando como eles irão atuar dentro da Estratégia de Inovação da empresa beneficiária. O projeto deve estar relacionado a pelo menos uma das missões da Nova Indústria Brasil (NIB), conforme estabelecido na Resolução MDIC/CNDI/01/2023, de 6 de julho de 2023. O valor solicitado à Finep/FNDCT em cada proposta deverá, obrigatoriamente, ser de no mínimo R$ 3.000.000,00 (três milhões de reais) e de, no máximo, R$ 30.000.000,00 (trinta milhões de reais). WEBINAR No dia 03/08/2026, às 15h, a Finep realizou um webinar sobre a Chamada Conhecimento Brasil em formato virtual. O objetivo foi apresentar a Chamada Pública e esclarecer dúvidas relacionadas à submissão de propostas. Veja aqui a apresentação. Prazo para envio das propostas alterado para 11/09/2026, 18h00 (horário de Brasília) Dúvidas a respeito do conteúdo do subprograma deverão ser dirigidas exclusivamente para o endereço eletrônico cp_conhecimentobrasil@finep.gov.br.",
   "funder": "Finep / FNDCT",
   "instrument": {
    "type": "subvencao_economica",
    "repayable": false
   },
   "status": "open",
   "dates": {
    "published": "2024-08-07",
    "deadline": "2026-09-11"
   },
   "eligibility": {
    "organization_types": [
     "empresa"
    ],
    "geography": [
     "BR"
    ]
   },
   "themes": [
    "tecnologias_digitais_e_conectividade",
    "tic",
    "transformacao_digital",
    "energia_e_transicao_sustentavel",
    "energia",
    "agro_bioeconomia_e_alimentos",
    "bioeconomia",
    "agroindustria",
    "saude_e_ciencias_da_vida",
    "saude",
    "cidades_e_desenvolvimento_urbano",
    "mobilidade_e_logistica",
    "mobilidade",
    "espaco_defesa_e_seguranca",
    "educacao_cultura_e_sociedade",
    "cultura",
    "educacao",
    "conhecimento_brasil"
   ],
   "funding": {
    "program_budget": null
   },
   "documents": [
    {
     "title": "aqui",
     "url": "https://www.finep.gov.br/documents/d/global/chamada-conhecimento-brasil-webinar-pdf",
     "published": null
    }
   ],
   "changes": [],
   "change_status": "unchanged",
   "matching": {
    "eligible": true,
    "ponte_score": 100,
    "portfolio_tags": [
     "bioeconomia",
     "agtech",
     "saude",
     "pdi",